{"edges":[{"from":"temp:out","to":"smooth:in"},{"from":"smooth:out","to":"console:in"},{"from":"smooth:out","to":"hot:in"},{"from":"hot:out","to":"led:on"}],"flow":"fan-control","nodes":[{"id":"temp","params":{"addr":"0x48","rate_hz":1},"type":"sensor.tmp117"},{"id":"smooth","params":{"window":8},"type":"filter.moving_avg"},{"id":"console","params":{},"type":"debug.console"},{"id":"hot","params":{"hysteresis":1.0,"level":27.0},"type":"logic.threshold"},{"id":"led","params":{"pin":"PC13"},"type":"actuator.gpio_led"}],"version":1}